AT5G40330,MYB23,"Transcription factor MYB23; Transcription activator, when associated with BHLH2/EGL3/MYC146 or BHLH12/MYC1. Regulates the epidermal cell fate specification. Mediates the formation of columellae and accumulation of mucilages on seed coats. Controls the elongation of epidermal cells positively in roots but negatively in stems, leading to the promotion of primary roots elongation and repression of leaves and stems elongation, respectively. Ovoids ectopic root-hair formation, probably by inducing GL2 in roots. Controls trichome initiation and branching.",NA,NA,Yes,NA,Yes
AT4G34990,MYB32,Transcription factor MYB32.,NA,Yes,NA,Yes,NA
AT5G57620,MYB36,"Transcription factor MYB36; Transcription factors that activates genes required for endodermal differentiation but represses genes involved in proliferative divisions, thus regulating the transition from proliferation to differentiation in root endodermis. Required for Casparian strip formation by positively regulating the expression of the Casparian strip genes CASP1, PER64 and ESB1 and other endodermis-specific genes, thus triggering correct localized lignin biosynthesis in root endodermis and subsequently regulating global ion homeostasis.",NA,NA,NA,NA,NA
AT5G16600,MYB43,Putative transcription factor.,NA,Yes,NA,Yes,NA
AT5G12870,MYB46,Transcription factor MYB46; Transcription activator. Involved in the regulation of secondary wall biosynthesis in fibers and vessels. Transcription activator of the mannan synthase CSLA9 that recognizes and binds to the DNA consensus sequence 5'-[AG][GT]T[AT]GGT[GA]-3' cis- regulatory element of CSLA9 promoter. Transcription factor that acts as molecular switch in the NAC012/SND1-mediated transcriptional network regulating secondary wall biosynthesis. Is directly activated by NAC012/SND1. Functions redundantly with MYB83 in the transcriptional regulatory cascade leading to secondary wa [...] ,NA,Yes,NA,Yes,NA
AT1G17950,MYB52,"Transcription factor MYB52; Transcription factor that confers sensitivity to abscisic acid (ABA) and salt, but tolerance to drought. Regulates secondary cell wall (SCW) biosynthesis, especially in interfascicular and xylary fibers.",NA,Yes,NA,Yes,NA
AT1G08810,MYB60,Transcription factor MYB60; Transcription factor involved in the regulation of gene (e.g. drought-regulated and flavonoid biosynthetic genes) expression and stomatal movements leading to negative regulation of responses to drought and responses to other physiological stimuli (e.g. light). Promotes guard cell deflation in response to water deficit. Triggers root growth upon osmotic stress (e.g. mannitol containing medium).,NA,NA,NA,NA,NA
AT1G09540,MYB61,"Transcription factor MYB61; Transcription factor that coordinates a small network of downstream target genes required for several aspects of plant growth and development, such as xylem formation and xylem cell differentiation, and lateral root formation. Regulates a specific set of target genes by binding DNA to the AC cis- element 5'-ACCTAC-3'. Functions as a transcriptional regulator of stomatal closure. Plays a role the regulation of stomatal pore size independently of abscisic acid (ABA). Required for seed coat mucilage deposition during the development of the seed coat epidermis.  [...] ",NA,Yes,NA,Yes,NA
AT2G16720,MYB7,"Transcription factor MYB7; Transcription factor involved in the negative regulation of flavonol biosynthesis. Represses the early phenylpropanoid genes, phenylalanine ammonia-lyase (PAL), cinnamate 4-hydroxylase (C4H) and 4- coumarate-CoA ligase (4CL), as well as the flavonoid-specific genes, flavonoid 3'-hydroxylase (F3'H) and dihydroflavonol 4-reductase (DFR). Plays a role in seed germination inhibition. Negatively regulates the expression of the abscisic acid (ABA) signaling transcription factor ABI5 in seeds.",NA,Yes,NA,Yes,NA
AT3G08500,MYB83,"Transcription factor MYB83; Transcription factor that acts as molecular switch in the NAC012/SND1-mediated transcriptional network regulating secondary wall biosynthesis. Is directly activated by NAC012/SND1 and its close homologs, including NAC043/NST1, NAC066/NST2, NAC101/VND6 and NAC030/VND7. Is required for functional expression of a number of secondary wall-associated transcription factors and secondary wall biosynthetic genes involved in cellulose, xylan and lignin synthesis. Functions redundantly with MYB46 in the transcriptional regulatory cascade leading to secondary wall form [...] ",NA,Yes,NA,Yes,NA
AT4G22680,MYB85,Myb family transcription factor.,NA,Yes,NA,Yes,NA
AT5G26660,MYB86,Transcription factor MYB86; Probable transcription factor.,NA,NA,Yes,NA,Yes
AT2G02820,MYB88,"Transcription factor MYB88; Transcription factor that binds to DNA in promoters cis- regulatory element 5'-GGCGCGC-3' of cell cycle genes, including cyclins, cyclin-dependent kinases (CDKs), and components of the pre- replication complex. Binds to DNA in promoters cis-regulatory element 5'-AGCCG-3' of auxin regulated genes (e.g. PIN3 and PIN7). Together with FAMA and MYB124, ensures that stomata contain just two guard cells (GCs) by enforcing a single symmetric precursor cell division before stomatal maturity. Represses the expression of the mitosis-inducing factors CDKB1-1 and CDKA-1, [...] ",NA,NA,Yes,NA,NA
AT5G46760,MYC3,"Transcription factor MYC3; Transcription factor involved in tryptophan, jasmonic acid (JA) and other stress-responsive gene regulation. With MYC2 and MYC4, controls additively subsets of JA-dependent responses. Can form complexes with all known glucosinolate-related MYBs to regulate glucosinolate biosynthesis. Binds to the G-box (5'-CACGTG-3') of promoters. Activates multiple TIFY/JAZ promoters.",NA,NA,Yes,NA,NA
AT4G17880,MYC4,"Transcription factor MYC4; Transcription factor involved in jasmonic acid (JA) gene regulation. With MYC2 and MYC3, controls additively subsets of JA- dependent responses. Can form complexes with all known glucosinolate- related MYBs to regulate glucosinolate biosynthesis. Binds to the G-box (5'-CACGTG-3') of promoters. Activates multiple TIFY/JAZ promoters.",NA,NA,Yes,NA,NA
AT5G13780,NAA10,"N-terminal acetyltransferase A complex catalytic subunit NAA10; Catalytic subunit of the NatA N-alpha-acetyltransferase complex. Required for male gametocyte development, embryogenesis, suspensor development and the formation of the quiescent center (QC) in the root meristem. Involved in plant immunity through the regulation of SNC1 and RPM1 stability.",NA,NA,NA,NA,NA
AT1G02220,NAC003,NAC domain-containing protein 3.,NA,NA,NA,NA,NA
AT1G02250,NAC005,NAC domain-containing protein 5.,NA,Yes,NA,Yes,NA
AT1G12260,NAC007,"NAC domain-containing protein 7; Transcription activator that binds to the secondary wall NAC binding element (SNBE), 5'- (T/A)NN(C/T)(T/C/G)TNNNNNNNA(A/C)GN(A/C/T)(A/T)-3', in the promoter of target genes (By similarity). Involved in xylem formation by promoting the expression of secondary wall-associated transcription factors and of genes involved in secondary wall biosynthesis and programmed cell death, genes driven by the secondary wall NAC binding element (SNBE). Triggers thickening of secondary walls.",NA,Yes,NA,Yes,NA
AT1G28470,NAC010,NAC domain-containing protein 10; Transcriptional activator that plays a regulatory role in the development of secondary cell wall fibers. Is a direct target of SND1.,NA,Yes,NA,Yes,NA
AT1G62700,NAC026,"NAC domain-containing protein 26; Transcription activator that binds to the secondary wall NAC binding element (SNBE), 5'- (T/A)NN(C/T)(T/C/G)TNNNNNNNA(A/C)GN(A/C/T)(A/T)-3', in the promoter of target genes (By similarity). Involved in xylem formation by promoting the expression of secondary wall-associated transcription factors and of genes involved in secondary wall biosynthesis and programmed cell death, genes driven by the secondary wall NAC binding element (SNBE). Triggers thickening of secondary walls. Belongs to the plant vascular related NAC-domain protein family.",NA,Yes,NA,Yes,NA
AT1G71930,NAC030,"NAC domain-containing protein 30; Transcription activator that binds to the secondary wall NAC binding element (SNBE), 5'- (T/A)NN(C/T)(T/C/G)TNNNNNNNA(A/C)GN(A/C/T)(A/T)-3', in the promoter of target genes (e.g. genes involved in secondary wall biosynthesis, cell wall modification such as xylan accumulation, and programmed cell death). Involved in xylem formation in roots and shoots, especially regulating protoxylem vessel differentiation by promoting immature xylem vessel-specific genes expression. Can activate the expression of several genes including XCP1, MYB46, NAC010/SND3, MYB10 [...] ",NA,Yes,NA,Yes,NA
AT2G18060,NAC037,"NAC domain-containing protein 37; Transcription activator that binds to the secondary wall NAC binding element (SNBE), 5'- (T/A)NN(C/T)(T/C/G)TNNNNNNNA(A/C)GN(A/C/T)(A/T)-3', in the promoter of target genes (By similarity). Involved in xylem formation by promoting the expression of secondary wall-associated transcription factors and of genes involved in secondary wall biosynthesis and programmed cell death, genes driven by the secondary wall NAC binding element (SNBE). Triggers thickening of secondary walls.",NA,Yes,NA,Yes,NA
AT2G46770,NAC043,"NAC domain-containing protein 43; Transcription activator of genes involved in biosynthesis of secondary walls. Together with NST2 and NST3, required for the secondary cell wall thickening of sclerenchymatous fibers, secondary xylem (tracheary elements), and of the anther endocethium, which is necessary for anther dehiscence. May also regulate the secondary cell wall lignification of other tissues.",NA,Yes,NA,Yes,NA
AT3G03200,NAC045,"NAC domain-containing protein 45; Transcription factor directing sieve element enucleation and cytosol degradation. Not required for formation of lytic vacuoles. Regulates, with NAC086, the transcription of NEN1, NEN2, NEN3, NEN4, RTM1, RTM2, UBP16, PLDZETA, ABCB10 and At1g26450.",NA,Yes,NA,NA,NA
AT3G15510,NAC056,"NAC transcription factor 56; Transcription factor of the NAC family (Probable). Together with NAC018/NARS2, regulates embryogenesis by regulating the development and degeneration of ovule integuments, a process required for intertissue communication between the embryo and the maternal integument.",NA,NA,NA,NA,NA
AT4G29230,NAC075,"NAC domain-containing protein 75; Transcription activator involved in xylem formation. Promotes the expression of the secondary wall-associated transcription factor MYB46. Functions upstream of NAC030/VND7, a master switch of xylem vessel differentiation. Acts as upstream regulator of NAC101/VND6 and LBD30/ASL19.",NA,Yes,NA,NA,NA
AT4G36160,NAC076,"NAC domain-containing protein 76; Transcription activator that binds to the secondary wall NAC binding element (SNBE), 5'- (T/A)NN(C/T)(T/C/G)TNNNNNNNA(A/C)GN(A/C/T)(A/T)-3', in the promoter of target genes (By similarity). Involved in xylem formation by promoting the expression of secondary wall-associated transcription factors and of genes involved in secondary wall biosynthesis and programmed cell death, genes driven by the secondary wall NAC binding element (SNBE). Triggers thickening of secondary walls. Belongs to the plant vascular related NAC-domain protein family.",NA,Yes,NA,Yes,NA
AT5G13180,NAC083,"NAC domain-containing protein 83; Transcriptional repressor that negatively regulates the expression of genes involved in xylem vessel formation. Represses the transcriptional activation activity of NAC030/VND7, which regulates protoxylem vessel differentiation by promoting immature xylem vessel- specific genes expression. Transcriptional activator that regulates the COLD-REGULATED (COR15A and COR15B) and RESPONSIVE TO DEHYDRATION (LTI78/RD29A and LTI65/RD29B) genes by binding directly to their promoters. Mediates signaling crosstalk between salt stress response and leaf aging process. [...] ",NA,Yes,NA,Yes,NA
AT5G14000,NAC084,NAC domain containing protein 84.,NA,NA,NA,NA,NA
AT5G17260,NAC086,"NAC domain-containing protein 86; Transcription factor directing sieve element enucleation and cytosol degradation. Not required for formation of lytic vacuoles. Regulates, with NAC045, the transcription of NEN1, NEN2, NEN3, NEN4, RTM1, RTM2, UBP16, PLDZETA, ABCB10 and At1g26450.",NA,Yes,NA,NA,NA
AT5G62380,NAC101,"NAC domain-containing protein 101; Transcription activator that binds to the secondary wall NAC binding element (SNBE), 5'- (T/A)NN(C/T)(T/C/G)TNNNNNNNA(A/C)GN(A/C/T)(A/T)-3', and to the tracheary elements (TE) specific regulating cis-element (TERE), 5'- CTTNAAAGCNA-3', in the promoter of target genes (e.g. genes involved in secondary wall biosynthesis, cell wall modification such as xylan accumulation, and programmed cell death). Involved in xylem formation in roots and shoots, especially regulating metaxylem vessel differentiation by promoting immature xylem vessel-specific genes exp [...] ",NA,Yes,NA,Yes,NA
AT5G64530,NAC104,NAC domain-containing protein 104; Probable transcription factor that influences tracheary elements and xylem development by negatively regulating secondary cell wall fiber synthesis and programmed cell death.,NA,Yes,NA,Yes,NA
AT5G66300,NAC105,"NAC domain-containing protein 105; Transcription activator that binds to the secondary wall NAC binding element (SNBE), 5'- (T/A)NN(C/T)(T/C/G)TNNNNNNNA(A/C)GN(A/C/T)(A/T)-3', in the promoter of target genes (By similarity). Involved in xylem formation by promoting the expression of secondary wall-associated transcription factors and of genes involved in secondary wall biosynthesis and programmed cell death, genes driven by the secondary wall NAC binding element (SNBE). Triggers thickening of secondary walls.",NA,Yes,NA,Yes,NA
AT5G39610,NAC92,"NAC domain-containing protein 92; Transcription activator that binds to DNA in promoters of target genes on a specific bipartite motif 5'-[ACG][CA]GT[AG](5- 6n)[CT]AC[AG]-3'. Promotes lateral root development. Triggers the expression of senescence-associated genes during age-, salt- and dark-induced senescence through a regulatory network that may involve cross-talk with salt- and H(2)O(2)- dependent signaling pathways. Regulates also genes during seed germination. Regulates positively aging-induced cell death. Involved in age-related resistance (ARR) against Pseudomonas syringae pv. t [...] ",NA,NA,NA,NA,NA
AT5G44160,NUC,Zinc finger protein NUTCRACKER; Transcription activator that binds to the DNA sequence 5'- CTTTTGTCC-3'. Regulates photoperiodic flowering by modulating sugar transport and metabolism. Regulates SUS1 and SUS4. Transcription factor that regulates tissue boundaries and asymmetric cell division. Contributes to the sequestration of 'SHORT-ROOT' to the nucleus.,NA,NA,NA,NA,NA
AT2G25170,PKL,CHD3-type chromatin-remodeling factor PICKLE; Chromatin remodeling factor that represses the expression of embryonic trait genes (such as NFYB9/LEC1) upon and after seed germination and thus enables the developmental switch to post- germinative growth. Silences some MADS-box proteins such as PHE1 and PHE2. Plays a role during carpel differentiation. Regulates late processes in cytokinin signaling.,NA,NA,NA,NA,NA
AT3G20840,PLT1,"AP2-like ethylene-responsive transcription factor PLT1; Probably acts as a transcriptional activator. Binds to the GCC-box pathogenesis-related promoter element. May be involved in the regulation of gene expression by stress factors and by components of stress signal transduction pathways (By similarity). Master regulator of basal/root fate. Essential for root quiescent center (QC) and columella specification, stem cell activity, as well as for establishment of the stem cell niche during embryogenesis. Modulates the root polar auxin transport by regulating the distribution of PIN genes [...] ",NA,NA,NA,NA,NA
AT1G51190,PLT2,"AP2-like ethylene-responsive transcription factor PLT2; Probably acts as a transcriptional activator. Binds to the GCC-box pathogenesis-related promoter element. May be involved in the regulation of gene expression by stress factors and by components of stress signal transduction pathways (By similarity). Master regulator of basal/root fate. Essential for root quiescent center (QC) and columella specification, stem cell activity, as well as for establishment of the stem cell niche during embryogenesis. Modulates the root polar auxin transport by regulating the distribution of PIN genes [...] ",NA,NA,NA,NA,NA
AT1G74500,PRE3,Transcription factor PRE3; Atypical and probable non DNA-binding bHLH transcription factor required for MONOPTEROS-dependent root initiation in embryo. Promotes the correct definition of the hypophysis cell division plane. Transcriptionally controlled by MONOPTEROS. Moves from its site of synthesis in pro-embryos cells into the hypophysis. Regulates brassinosteroid (BR) signaling by sequestering negative BR signaling components. May function as positive regulator of gibberellin signaling. May play a role in the regulation of light signaling and possibly auxin signaling.,NA,NA,NA,NA,NA
AT2G12646,Q1G3Q4_ARATH,PLATZ transcription factor family protein.,NA,NA,NA,NA,NA
AT5G19790,RAP2-11,Ethylene-responsive transcription factor RAP2-11; Probably acts as a transcriptional activator. Binds to the GCC-box pathogenesis-related promoter element. May be involved in the regulation of gene expression by stress factors and by components of stress signal transduction pathways (By similarity); Belongs to the AP2/ERF transcription factor family. ERF subfamily.,NA,NA,NA,NA,NA
AT1G53910,RAP2-12,Ethylene-responsive transcription factor RAP2-12; Transcription factor involved in the activation of hypoxic gene expression and in ethylene response. Partially redundant with RAP2-2. Acts as a downstream regulator in the ethylene signaling pathway; Belongs to the AP2/ERF transcription factor family. ERF subfamily.,NA,NA,NA,NA,NA
AT1G13260,RAV1,"AP2/ERF and B3 domain-containing transcription factor RAV1; Binds specifically to bipartite recognition sequences composed of two unrelated motifs, 5'-CAACA-3' and 5'-CACCTG-3'. May function as negative regulator of plant growth and development. Belongs to the AP2/ERF transcription factor family. RAV subfamily.",NA,NA,NA,NA,NA
AT3G12280,RBR1,"Retinoblastoma-related protein 1; Key regulator of entry into cell division. Acts as a transcription repressor of E2F target genes, whose activity is required for progress from the G1 to the S phase of the cell cycle. Hyperphosphorylation by CDKA-1 prevents the binding to E2F transcription factors, allowing G1 to S phase transition to operate. Forms a stable complex with E2FA that functions in maintaining cell proliferation through repression of cell differentiation. Plays a central role in the mechanism controlling meristem cell differentiation, cell fate establishment and cell fate m [...] ",NA,NA,Yes,NA,Yes
AT3G48430,REF6,"Lysine-specific demethylase REF6; Histone demethylase that demethylates 'Lys-27' (H3K27me) of histone H3. Demethylates both tri- (H3K27me3) and di-methylated (H3K27me2) H3K27me. Demethylates also H3K4me3/2 and H3K36me3/2 in an in vitro assay. Involved in the transcriptional regulation of hundreds of genes regulating developmental patterning and responses to various stimuli. Binds DNA via its four zinc fingers in a sequence- specific manner, 5'-CTCTGYTY-3', to promote the demethylation of H3K27me3 and the regulation of organ boundary formation. Involved in the regulation of flowering ti [...] ",NA,NA,NA,NA,NA
AT5G60690,REV,"Homeobox-leucine zipper protein REVOLUTA; Probable transcription factor involved in the regulation of interfascicular fiber (cortical cells) and secondary xylem differentiation in the inflorescence stems. Required for lateral shoot meristems (LSMs) and flower meristems (FMs) initiation. May be involved in the determination of vascular patterning and organ polarity. Directly regulates the expression of AGO10, ZPR1, ZPR2, ZPR3 and ZPR4. Required to regulate adaxial-abaxial polarity and leaf axial patterning.",NA,Yes,NA,Yes,NA
AT2G01570,RGA,"DELLA protein RGA; Probable transcriptional regulator that acts as a repressor of the gibberellin (GA) signaling pathway. Probably acts by participating in large multiprotein complexes that repress transcription of GA-inducible genes. Positively regulates XERICO expression in seeds. Upon GA application, it is degraded by the proteasome, allowing the GA signaling pathway. Compared to other DELLA proteins, it is the most sensitive to GA application. No effect of the BOI proteins on its stability. Its activity is probably regulated by other phytohormones such as auxin and ethylene, attenu [...] ",Yes,NA,NA,NA,NA
AT3G60630,SCL22,Scarecrow-like protein 22; Probable transcription factor involved in plant development.,NA,NA,Yes,NA,Yes
AT2G45160,SCL27,Scarecrow-like protein 27; Probable transcription factor involved in plant development.,NA,NA,Yes,NA,Yes
AT4G00150,SCL6,Scarecrow-like protein 6; Probable transcription factor involved in plant development.,NA,NA,Yes,NA,Yes
AT3G54220,SCR,"Protein SCARECROW; Transcription factor required for quiescent center cells specification and maintenance of surrounding stem cells, and for the asymmetric cell division involved in radial pattern formation in roots. Essential for cell division but not differentiation of the ground tissue. Also required for normal shoot gravitropism. Regulates the radial organization of the shoot axial organs. Binds to the promoter of MGP, NUC, RLK and SCL3. Restricts SHR movment and sequesters it into the nucleus of the endodermis. Belongs to the GRAS family.",NA,NA,NA,NA,NA
AT3G26744,SCRM,"Transcription factor ICE1; Transcriptional activator that regulates the cold-induced transcription of CBF/DREB1 genes. Binds specifically to the MYC recognition sites (5'-CANNTG-3') found in the CBF3/DREB1A promoter. Mediates stomatal differentiation in the epidermis probably by controlling successive roles of SPCH, MUTE, and FAMA. Functions as a dimer with SPCH during stomatal initiation.",NA,NA,Yes,NA,NA
AT4G37650,SHR,"Protein SHORT-ROOT; Transcription factor required for quiescent center cells specification and maintenance of surrounding stem cells, and for the asymmetric cell division involved in radial pattern formation in roots. Essential for both cell division and cell specification. Regulates the radial organization of the shoot axial organs and is required for normal shoot gravitropism. Directly controls the transcription of SCR, and when associated with SCR, of MGP, RLK, TRI, NUC and SCL3.",NA,NA,NA,NA,NA
AT1G79580,SMB,"Protein SOMBRERO; Transcription regulator. Together with BRN1 and BRN2, regulates cellular maturation of root cap. Represses stem cell-like divisions in the root cap daughter cells, and thus promotes daughter cell fate. Inhibits expression of its positive regulator FEZ in a feedback loop for controlled switches in cell division plane. Promotes the expression of genes involved in secondary cell walls (SCW) biosynthesis.",NA,NA,NA,NA,NA
AT1G25580,SOG1,"SUPPRESSOR OF GAMMA RESPONSE 1; Transcription factor regulating the transcriptional activation response to gamma irradiation. Required for stem-cell death induced by UVB or by gamma irradiation. Not required for ATM activation, but participates in pathways governed by both ATM and ATR sensor kinases. Involved in DNA damage response (DDR) system that regulates cell cycle arrest. Functional homolog of animal p53. Regulates SMR5 and SMR7 transcription. Regulates DNA repair and cytokinin signaling separately and plays a key role in controlling lateral root formation under genotoxic stress.",NA,NA,NA,NA,NA
AT4G08455,T15F16.14,BTB/POZ domain-containing protein At4g08455; May act as a substrate-specific adapter of an E3 ubiquitin- protein ligase complex (CUL3-RBX1-BTB) which mediates the ubiquitination and subsequent proteasomal degradation of target proteins.,NA,NA,NA,NA,NA
AT5G07400,T2I1.110,Forkhead-associated domain-containing protein / FHA domain-containing protein.,NA,NA,NA,NA,NA
AT3G47620,TCP14,"Transcription factor TCP14; Transcription factor involved the regulation of plant development. Together with TCP15, modulates plant stature by promoting cell division in young internodes. Represses cell proliferation in leaf and floral tissues. Together with TCP15, acts downstream of gibberellin (GA), and the stratification pathways that promote seed germination. Involved in the control of cell proliferation at the root apical meristem (RAM) by regulating the activity of CYCB1-1. Involved in the regulation of seed germination. May regulate the activation of embryonic growth potential d [...] ",NA,NA,NA,NA,NA
AT1G69690,TCP15,"Transcription factor TCP15; Transcription factor involved the regulation of plant development. Together with TCP14, modulates plant stature by promoting cell division in young internodes. Represses cell proliferation in developing leaf blade and specific floral tissues. Together with TCP15, acts downstream of gibberellin (GA), and the stratification pathways that promote seed germination. Involved in the control of cell proliferation at the root apical meristem (RAM) by regulating the activity of CYCB1-1. Acts together with SPY to promote cytokinin responses that affect leaf shape and  [...] ",NA,NA,NA,NA,NA
AT2G45680,TCP9,Transcription factor TCP9.,NA,NA,NA,NA,NA
AT4G14770,TCX2,Protein tesmin/TSO1-like CXC 2; Plays a role in development of both male and female reproductive tissues; Belongs to the lin-54 family.,NA,NA,Yes,NA,NA
AT3G22760,TCX3,Protein tesmin/TSO1-like CXC 3; Plays a role in development of both male and female reproductive tissues.,NA,NA,Yes,NA,NA
