AT1G14920,GAI,"DELLA protein GAI; Transcriptional regulator that acts as a repressor of the gibberellin (GA) signaling pathway. Transcription coactivator of the zinc finger transcription factors GAF1/IDD2 and ENY/IDD1 in regulation of gibberellin homeostasis and signaling. No effect of the BOI proteins on its stability. Probably acts by participating in large multiprotein complexes that repress transcription of GA-inducible genes. Positively regulates XERICO expression. In contrast to RGA, it is less sensitive to GA. Its activity is probably regulated by other phytohormones such as auxin and ethylene [...] ",Yes,NA,NA,NA,NA
AT4G21060,GALT2,Hydroxyproline O-galactosyltransferase GALT2; Possesses hydroxyproline O-galactosyltransferase activity. Transfers galactose from UDP-galactose to hydroxyproline residues in the arabinogalactan proteins (AGPs). Is specific for AGPs containing non-contiguous peptidyl hydroxyproline residues. Utilizes UDP-galactose solely as sugar donor. The addition of galactose onto the peptidyl hydroxyproline residues in AGP core proteins represents the first committed step in arabinogalactan polysaccharide addition. AGP glycans play essential roles in both vegetative and reproductive plant growth.,NA,NA,Yes,NA,Yes
AT5G25830,GATA12,"GATA transcription factor 12; Transcriptional activator that specifically binds 5'-GATA-3' or 5'-GAT-3' motifs within gene promoters. May be involved in the regulation of some light-responsive genes (By similarity). Transcription activator involved in xylem formation. Functions upstream of NAC030/VND7, a master switch of xylem vessel differentiation ; Belongs to the type IV zinc-finger family. Class A subfamily.",NA,Yes,NA,NA,NA
AT5G26930,GATA23,GATA transcription factor 23; Transcriptional regulator that specifically binds 5'-GATA-3' or 5'-GAT-3' motifs within gene promoters; Belongs to the type IV zinc-finger family. Class B subfamily.,NA,NA,NA,NA,NA
AT5G28640,GIF1,"GRF1-interacting factor 1; Transcription coactivator that plays a role in the regulation of cell expansion in leaf and cotyledons tissues. Component of a network formed by miR396, the GRFs and their interacting factors (GIFs) acting in the regulation of meristem function, at least partially through the control of cell proliferation. Appears to function synergistically with GRF1 as a transcriptional coactivator. Acts together with GRF5 for the development of appropriate leaf size and shape through the promotion and/or maintenance of cell proliferation activity in leaf primordia. Plays a [...] ",NA,NA,NA,NA,NA
AT1G68360,GIS3,"Zinc finger protein GIS3; Probable transcription factor required for the initiation of inflorescence trichomes in response to gibberellin and cytokinin. Acts upstream of GIS, GIS2, ZFP8, and the trichome initiation factors GL1 and GL3. Binds the promoter region of GIS and GIS2, which may be direct targets of GIS3.",NA,NA,Yes,NA,Yes
AT1G79840,GL2,Homeobox-leucine zipper protein GLABRA 2; Probable transcription factor required for correct morphological development and maturation of trichomes as well as for normal development of seed coat mucilage. Regulates the frequency of trichome initiation and determines trichome spacing.,NA,NA,Yes,NA,Yes
AT5G41315,GL3,"Transcription factor GLABRA 3; Transcription activator, when associated with MYB75/PAP1, MYB90/PAP2 or TT2. Involved in epidermal cell fate specification. Regulates negatively stomata formation, but, in association with TTG1 and MYB0/GL1, promotes trichome formation, branching and endoreplication. Regulates also trichome cell wall maturation. Together with MYB66/WER, promotes the formation of non-hair cells in root epidermis cells in the N position. Whereas together with CPC, promotes the formation of hair cells in root epidermis cells in the H position by inhibiting non-hair cell form [...] ",NA,NA,Yes,NA,Yes
AT4G37740,GRF2-2,"Growth-regulating factor 2; Transcription activator that plays a role in the regulation of cell expansion in leaf and cotyledons tissues. Component of a network formed by miR396, the GRFs and their interacting factors (GIFs) acting in the regulation of meristem function, at least partially through the control of cell proliferation.",NA,NA,NA,NA,NA
AT2G36400,GRF3-2,"Growth-regulating factor 3; Transcription activator that plays a role in the regulation of cell expansion in leaf and cotyledons tissues. Component of a network formed by miR396, the GRFs and their interacting factors (GIFs) acting in the regulation of meristem function, at least partially through the control of cell proliferation. microRNA396-GRF1/GRF3 regulatory module acts as a developmental regulator in the reprogramming of root cells during cyst nematode infection, leading to the formation of the syncytium.",NA,NA,NA,NA,NA
AT1G33240,GTL1,"Trihelix transcription factor GTL1; Transcription repressor that binds specific DNA sequence such as GT3 box 5'-GGTAAA-3' in the SDD1 promoter. Negative regulator of water use efficiency (WUE) via the promotion of stomatal density and distribution by the transcription repression of SDD1. Regulates the expression of several cell cycle genes and endoreduplication, especially in trichomes where it prevents ploidy-dependent plant cell growth.",NA,NA,Yes,NA,Yes
AT3G54610,HAG1,Histone acetyltransferase GCN5; Acetylates histone H3 and ADA2 proteins in vitro. Acetylates 'Lys-14' of histone H3. Acetylation of histones gives a specific tag for epigenetic transcription activation. Operates in concert with certain DNA-binding transcriptional activators. Acts via the formation of large multiprotein complexes that modify the chromatin (By similarity). Belongs to the acetyltransferase family. GCN5 subfamily.,NA,NA,NA,NA,NA
AT5G47370,HAT2,Homeobox-leucine zipper protein HAT2; Probable transcription factor that plays a role in auxin- mediated morphogenesis. Negatively regulates lateral root elongation.,NA,NA,NA,NA,NA
AT4G16780,HAT4,Homeobox-leucine zipper protein HAT4; Probable transcription factor involved in the negative regulation of cell elongation and specific cell proliferation processes such as lateral root formation and secondary growth of the vascular system. Acts as mediator of the red/far-red light effects on leaf cell expansion in the shading response. Binds to the DNA sequence 5'- CAAT[GC]ATTG-3'. Negatively regulates its own expression. Belongs to the HD-ZIP homeobox family. Class II subfamily.,NA,NA,NA,NA,NA
AT1G73360,HDG11,"Homeobox-leucine zipper protein HDG11; Transcription factor which acts as positive regulator of drought stress tolerance. Can transactivate CIPK3, NCED3 and ERECTA. Transactivates several cell-wall-loosening protein genes by directly binding to HD motifs in their promoters. These target genes play important roles in coordinating cell-wall extensibility with root development and growth. Transactivates CYP74A/AOS, AOC3, OPR3 and 4CLL5/OPCL1 genes by directly binding to HD motifs in their promoters. These target genes are involved in jasmonate (JA) biosynthesis, and JA signaling affects r [...] ",NA,NA,Yes,NA,Yes
AT1G17920,HDG12,Homeobox-leucine zipper protein HDG12; Probable transcription factor that acts as negative regulator of trichome branching in association with HDG11. May regulate cell differentiation and proliferation during root and shoot meristem development. Acts as positive regulator of SCL18/LAS expression.,NA,NA,Yes,NA,Yes
AT1G05230,HDG2,Homeobox-leucine zipper protein HDG2; Probable transcription factor.,NA,NA,Yes,NA,Yes
AT3G44750,HDT1,"Histone deacetylase HDT1; Probably mediates the deacetylation of lysine residues on the N-terminal part of the core histones (H2A, H2B, H3 and H4). Histone deacetylation gives a tag for epigenetic repression and plays an important role in transcriptional regulation, cell cycle progression and developmental events. Required for histone H3 'Lys-9' deacetylation. Involved in rRNA gene silencing in nucleolar dominance. Seems to be implicated in the regulation of genes involved in seeds development; Belongs to the histone deacetylase HD2 family.",NA,NA,NA,NA,NA
AT3G25790,HHO1,"Transcription factor HHO1; Probable factor involved in nitrate and phosphate signaling in roots. Integrates nitrate and phosphate starvation responses and adaptation of root architecture, depending on nutrient availabilities. Acts downstream of the nitrate sensor and transporter NPF6.3/NRT1.1. Represses primary root development in response to phosphate deficiency conditions, only when nitrate is present.",NA,NA,NA,NA,NA
AT1G68670,HHO2,"Transcription factor HHO2; Probable transcription factor involved in phosphate homeostasis. Involved in the regulation of the developmental response of lateral roots, acquisition and/or mobilization of phosphate and expression of a subset of genes involved in phosphate sensing and signaling pathway. Is a target of the transcription factor PHR1.",NA,NA,NA,NA,NA
AT1G25550,HHO3,Transcription factor HHO3; Probable transcription factor involved in phosphate signaling in roots.,NA,NA,NA,NA,NA
AT1G49560,HHO6,Transcription factor HHO6; Probable transcription factor involved in phosphate signaling in roots.,NA,NA,NA,NA,NA
AT1G13300,HRS1,"Transcription factor HRS1; Transcription factor involved in nitrate and phosphate signaling in roots. Integrates nitrate and phosphate starvation responses and adaptation of root architecture depending on nutrient availabilities. Acts downstream of the nitrate sensor and transporter NPF6.3/NRT1.1. Represses primary root development in response to phosphate deficiency conditions, only when nitrate is present. Involved in the modulation of primary root and root hair growth in phosphate-deprived environement. May be required for suppressing abscisic acid (ABA) signaling in germinating emb [...] ",NA,NA,NA,NA,NA
AT5G45710,HSFA4C,Heat stress transcription factor A-4c; Transcriptional activator that specifically binds DNA sequence 5'-AGAAnnTTCT-3' known as heat shock promoter elements (HSE). May be involved in general response to auxin.,NA,NA,NA,NA,NA
AT1G04550,IAA12,"Auxin-responsive protein IAA12; Aux/IAA proteins are short-lived transcriptional factors that function as repressors of early auxin response genes at low auxin concentrations. Repression is thought to result from the interaction with auxin response factors (ARFs), proteins that bind to the auxin- responsive promoter element (AuxRE). Formation of heterodimers with ARF proteins may alter their ability to modulate early auxin response genes expression.",Yes,NA,NA,NA,NA
AT4G14550,IAA14,"Auxin-responsive protein IAA14; Aux/IAA proteins are short-lived transcriptional factors that function as repressors of early auxin response genes at low auxin concentrations. Repression is thought to result from the interaction with auxin response factors (ARFs), proteins that bind to the auxin- responsive promoter element (AuxRE). Formation of heterodimers with ARF proteins may alter their ability to modulate early auxin response genes expression.",Yes,NA,NA,NA,NA
AT2G46990,IAA20,"Auxin-responsive protein IAA20; Aux/IAA proteins are short-lived transcriptional factors that function as repressors of early auxin response genes at low auxin concentrations. Repression is thought to result from the interaction with auxin response factors (ARFs), proteins that bind to the auxin- responsive promoter element (AuxRE). Formation of heterodimers with ARF proteins may alter their ability to modulate early auxin response genes expression.",Yes,NA,NA,NA,NA
AT5G25890,IAA28,"Auxin-responsive protein IAA28; Aux/IAA proteins are short-lived transcriptional factors that function as repressors of early auxin response genes at low auxin concentrations. Repression is thought to result from the interaction with auxin response factors (ARFs), proteins that bind to the auxin- responsive promoter element (AuxRE). Formation of heterodimers with ARF proteins may alter their ability to modulate early auxin response genes expression.",Yes,NA,NA,NA,NA
AT1G04240,IAA3,"Auxin-responsive protein IAA3; Aux/IAA proteins are short-lived transcriptional factors that function as repressors of early auxin response genes at low auxin concentrations. Repression is thought to result from the interaction with auxin response factors (ARFs), proteins that bind to the auxin- responsive promoter element (AuxRE). Plays a central role in auxin regulation of root growth, in gravitropism, and in lateral root formation. Regulated by an auxin-induced protein turnover. Formation of heterodimers with ARF proteins may alter their ability to modulate early auxin response gene [...] ",Yes,NA,NA,NA,NA
AT3G17600,IAA31,"Auxin-responsive protein IAA31; Aux/IAA proteins are short-lived transcriptional factors that function as repressors of early auxin response genes at low auxin concentrations. Repression is thought to result from the interaction with auxin response factors (ARFs), proteins that bind to the auxin- responsive promoter element (AuxRE). Formation of heterodimers with ARF proteins may alter their ability to modulate early auxin response genes expression.",Yes,NA,NA,NA,NA
AT2G22670,IAA8,"Auxin-responsive protein IAA8; Aux/IAA proteins are short-lived transcriptional factors that function as repressors of early auxin response genes at low auxin concentrations. Repression is thought to result from the interaction with auxin response factors (ARFs), proteins that bind to the auxin- responsive promoter element (AuxRE). Formation of heterodimers with ARF proteins may alter their ability to modulate early auxin response genes expression.",Yes,NA,NA,NA,NA
AT2G02080,IDD4,"Protein indeterminate-domain 4, chloroplastic; Transcription factor that may act a transcriptional activator of nuclear-encoded photosynthetic gene expression (Probable). Binds DNA via its zinc fingers. Recognizes and binds to SCL3 promoter sequence 5'-AGACAA-3' to promotes its expression when in complex with RGA.",NA,NA,NA,NA,NA
AT1G14580,IDD6,"Protein indeterminate-domain 6, chloroplastic; Probable transcription factor.",NA,NA,NA,NA,NA
AT1G32130,IWS1,Protein IWS1 homolog 1; Transcription factor involved in RNA polymerase II (RNAPII) transcription regulation. Involved in transcription elongation. May function at post-recruitment and elongation steps of transcription. May be recruited by BZR2/BES1 to target genes and promote their expression during transcription elongation process. Required for brassinosteroid (BR)-induced gene expression. Required the for regulation of numerous nitrogen-responsive genes in roots. Acts in roots to repress NRT2.1 transcription in response to high nitrogen supply. This repression is associated with an  [...] ,NA,NA,NA,NA,NA
AT5G03150,JKD,"Zinc finger protein JACKDAW; Transcription factor that, together with BIB, regulates tissue boundaries and asymmetric cell division by a rapid up-regulation of 'SCARECROW' (SCR), thus controlling the nuclear localization of 'SHORT-ROOT' (SHR) and restricting its action. Binds DNA via its zinc fingers. Recognizes and binds to SCL3 promoter sequence 5'- AGACAA-3' to promotes its expression when in complex with RGA. Confines CYCD6 expression to the cortex-endodermis initial/daughter (CEI/CEID) tissues. Required for radial patterning and stem cell maintenance. Counteracted by 'MAGPIE' (MGP [...] ",NA,NA,NA,NA,NA
AT4G20400,JMJ14,"Probable lysine-specific demethylase JMJ14; Transcriptional repressor. Histone demethylase that demethylates 'Lys-4' (H3K4me) of histone H3 with a higher activity for H3K4me3 and H3K4me2 than H3K4me1. No activity on H3K9me3/2, H3K36me3/2 and H3K27me3/2. Represses FT and TSF expression to inhibit the floral transition. Binds around the transcription start site of the FT locus. Involved in the DRM2-mediated maintenance of DNA methylation, but not required for the de novo DNA methylation. Required for demethylating histone H3K4me3 at the target of RNA silencing. Together with NAC051/NAC05 [...] ",NA,NA,NA,NA,NA
AT3G07610,JMJ25,"Lysine-specific demethylase JMJ25; Histone demethylase that demethylates 'Lys-9' (H3K9me) of histone H3 with a specific activity for H3K9me2 and H3K9me1. No activity on H3K9me3, H3K4me3/2/1, H3K27me3/2/1 and H3K36me3/2/1. Involved in the control of several developmental processes by protecting genes from silencing. Demethylates H3K9me2 in the promoter regions of RDR2 and DCL3 and mediates the repression of ectopic non-CpG methylation at RDR2, DCL3 and APC13 loci. Protects also a large number of transcribed genes from non-CpG methylation. May regulate gene expression via a pathway invol [...] ",NA,NA,Yes,NA,NA
AT3G20810,JMJ30,Lysine-specific demethylase JMJ30; Histone demethylase that demethylates 'Lys-36' (H3K36me) of histone H3 with a specific activity for H3K36me3 and H3K36me2. No activity on H3K36me1. Involved in the control of flowering time by demethylating H3K36me2 at the FT locus and repressing its expression. Acts within the central clock. Works in concert with TOC1 to promote the morning-phased clock genes CCA1 and LHY which function as components of the central oscillator.,NA,NA,NA,NA,NA
AT3G45880,JMJ32,2-oxoglutarate (2OG) and Fe(II)-dependent oxygenase superfamily protein.,NA,NA,NA,NA,NA
AT5G38840,K15E6.5,SMAD/FHA domain-containing protein.,NA,NA,NA,NA,NA
AT5G16560,KAN1,Transcription repressor KAN1; Transcriptional repressor that regulates lateral organ polarity. Promotes lateral organ abaxial identity by repressing the adaxial regulator ASYMMETRIC LEAVES2 (AS2) in abaxial cells. Required for abaxial identity in both leaves and carpels. Functions with KAN2 in the specification of polarity of the ovule outer integument. Regulates cambium activity by repressing the auxin efflux carrier PIN1. Plays a role in lateral root formation and development.,NA,Yes,NA,NA,NA
AT1G62990,KNAT7,Homeobox protein knotted-1-like 7; May be involved in secondary cell wall biosynthesis.,NA,Yes,NA,Yes,NA
AT5G47390,KUA1,Transcription factor KUA1; Transcriptional repressor. Direct regulator of the transcription of peroxidase (Prxs) and reactive oxygen species (ROS)-related genes via the recognition of 5'-ATCACA-3' motif. Binds to 5'-TATCCA-3' motif (TA box) and represses the activity of corresponding promoters (e.g. sugar response genes). Regulates hypocotyl elongation in response to darkness by enhancing auxin accumulation in a phytochrome-interacting factor (PIF) proteins-dependent manner. Promotes lateral roots formation. Promotes cell expansion during leaves development via the modulation of cell w [...] ,NA,NA,NA,NA,NA
AT2G40470,LBD15,LOB domain-containing protein 15; Belongs to the LOB domain-containing protein family.,NA,Yes,NA,NA,NA
AT2G42430,LBD16,"LOB domain-containing protein 16; Transcriptional activator. Involved in lateral root formation. Regulated by the transcriptional activators ARF7 and ARF19. Functions in the initiation and emergence of lateral roots, in conjunction with LBD18, downstream of ARF7 and ARF19. Acts downstream of the auxin influx carriers AUX1 and LAX1 in the regulation of lateral root initiation and development.",NA,NA,NA,NA,NA
AT2G45420,LBD18,"LOB domain-containing protein 18; Involved in the positive regulation of tracheary element (TE) differentiation. Involved in a positive feedback loop that maintains or promotes NAC030/VND7 expression that regulates TE differentiation- related genes. Functions in the initiation and emergence of lateral roots, in conjunction with LBD16, downstream of ARF7 and ARF19. Transcriptional activator that directly regulates EXPA14, a gene encoding a cell wall- loosening factor that promotes lateral root emergence. Activates EXPA14 by directly binding to a specific region of its promoter. Transcri [...] ",NA,Yes,NA,Yes,NA
AT3G58190,LBD29,LOB domain-containing protein 29; Involved in lateral root formation. Regulated by the transcriptional activators ARF7 and ARF19.,NA,NA,NA,NA,NA
AT1G16530,LBD3,LOB domain-containing protein 3; Belongs to the LOB domain-containing protein family.,NA,NA,NA,NA,NA
AT4G00220,LBD30,LOB domain-containing protein 30; Involved in the positive regulation of tracheary element (TE) differentiation. Involved in a positive feedback loop that maintains or promotes NAC030/VND7 expression that regulates TE differentiation- related genes; Belongs to the LOB domain-containing protein family.,NA,Yes,NA,Yes,NA
AT1G31320,LBD4,LOB domain-containing protein 4; Belongs to the LOB domain-containing protein family.,NA,Yes,NA,NA,NA
AT1G62830,LDL1,"Lysine-specific histone demethylase 1 homolog 1; Probable histone demethylase that reduces the levels of histone H3 'Lys-4' methylation in chromatin of the floral repressor FLOWERING LOCUS C (FLC) and the sporophytically silenced floral repressor FWA. Seems to act in partial redundancy with FLOWERING LOCUS D (FLD) to repress FLC expression. Required for cytosine methylation of FWA. Controls primary seed dormancy by regulating DOG1 and abscisic acid signaling-related genes. In association with OTU6/OTLD1, involved in transcriptional gene repression via histone deubiquitination and demet [...] ",NA,NA,NA,NA,NA
AT5G13910,LEP,"Ethylene-responsive transcription factor LEP; Cell division-promoting factor involved in leaf blade differentiation, inflorescence branching, as well as in carpel and silique shape. Promotes the number of xylem cells. Regulates positively the gibberellin signaling pathway leading to germination, hypocotyl elongation, and leaf expansion. Probably acts as a transcriptional activator. Binds to the GCC-box pathogenesis-related promoter element. May be involved in the regulation of gene expression by stress factors and by components of stress signal transduction pathways (By similarity); Be [...] ",NA,NA,NA,NA,NA
AT2G27230,LHW,Transcription factor LHW; Transcription activator that regulates root development; promotes the production of stele cells in roots. Coordinately controls the number of all vascular cell types by regulating the size of the pool of cells from which they arise.,NA,Yes,NA,Yes,NA
AT5G12330,LRP1,"Protein LATERAL ROOT PRIMORDIUM 1; Transcription activator that binds DNA on 5'-ACTCTAC-3' and promotes auxin homeostasis-regulating gene expression (e.g. YUC genes), as well as genes affecting stamen development, cell expansion and timing of flowering. Synergistically with other SHI-related proteins, regulates gynoecium, stamen and leaf development in a dose-dependent manner, controlling apical-basal patterning. Promotes style and stigma formation, and influence vascular development during gynoecium development. May also have a role in the formation and/or maintenance of the shoot api [...] ",NA,NA,NA,NA,NA
AT5G45420,MAMYB,"Transcription factor MAMYB; Transcription factor involved in the regulation of root hair development, possibly through auxin signaling. Its endoplasmic reticulum membrane localization is not compatible with its transcription factor activity in the nucleus. May be cleaved to target the nucleus.",NA,NA,Yes,NA,Yes
AT1G03840,MGP,"Zinc finger protein MAGPIE; Transcription factor that regulates tissue boundaries and asymmetric cell division. Contributes to the sequestration of 'SHORT-ROOT' to the nucleus. Interacts with the SCR and MGP promoters. Does not show transcription activity by itself, but regulates the transcription of downstream genes through interaction with other transcription factors. Binds DNA via its zinc fingers. Recognizes and binds to SCL3 promoter sequence 5'-AGACAA-3' to promotes its expression when in complex with RGA. Positively involved in gibberellic acid (GA) signaling.",NA,NA,NA,NA,NA
AT1G74660,MIF1,"Mini zinc finger protein 1; Inhibits zinc finger homeodomain (ZHD) transcription factors, such as ZHD5, by interacting with them to prevent both their nuclear localization and their DNA-binding properties. Involved in integrating signals from multiple hormones by preventing the expression of genes involved in gibberellic acid (GA), auxin and brassinosteroid signaling and by promoting the expression of abscisic acid (ABA)-responsive genes. Regulates several development aspects, including photomorphogenesis, apical dominance, longevity, flower morphology and fertility, as well as root an [...] ",NA,NA,NA,NA,NA
AT5G55580,MTERF9,"Transcription termination factor MTERF9, chloroplastic; Transcription termination factor required for processing and steady-state levels of plastid transcripts. May play a role in response to abiotic stresses.",NA,NA,NA,NA,NA
AT2G47460,MYB12,"Transcription factor MYB12; Flavonol-specific transcription activator involved in the regulation of several genes of flavonoid biosynthesis. Activates the expression of CHS, CHI, F3H and FLS1. Controls flavonol biosynthesis mainly in the root. Confers tolerance to UV-B.",NA,NA,NA,NA,NA
AT1G14350,MYB124,"Transcription factor MYB124; Transcription factor that binds to DNA in promoters cis- regulatory element 5'-GGCGCGC-3' of cell cycle genes, including cyclins, cyclin-dependent kinases (CDKs), and components of the pre- replication complex. Binds to DNA in promoters cis-regulatory element 5'-AGCCG-3' of auxin regulated genes (e.g. PIN3 and PIN7). Together with FAMA and MYB88, ensures that stomata contain just two guard cells (GCs) by enforcing a single symmetric precursor cell division before stomatal maturity. Represses the expression of the mitosis-inducing factors CDKB1-1 and CDKA-1, [...] ",NA,NA,Yes,NA,NA
AT1G66230,MYB20,"Transcription factor MYB20; Transcription factor that acts as positive regulator of abscisic acid (ABA) signaling in response to salt stress. Acts as negative regulator ABI1, ABI2 and PP2CA, which are protein phosphatases 2C acting as negative regulator of ABA signaling. Binds to the DNA specific sequence and core element 5'-ACGT-3' found in the promoters of ABI1 and PP2CA to negatively regulate their expression during ABA- dependent salt stress response.",NA,Yes,NA,Yes,NA
