GeneID,preferredName,annotation,Plant hormone signal transduction,"Stele (xylem, phloem, procambium)","Epidermis (atrichoblast, trichoblast, lrc)",Xylem ,Trichoblast
AT3G53680,A0A1I9LNX5,Acyl-CoA N-acyltransferase with RING/FYVE/PHD-type zinc finger domain-containing protein.,NA,NA,NA,NA,NA
AT1G71692,AGL12,"Agamous-like MADS-box protein AGL12; Probable transcription activator that regulates root development by controlling cell proliferation in root meristem. May mediate responses to auxin in the root. May act as promoter of the flowering transition through up-regulation of SOC, FT and LFY.",NA,NA,NA,NA,NA
AT3G57230,AGL16,"Agamous-like MADS-box protein AGL16; Probable transcription factor involved in the regulation of flowering time in long-day photoperiod. Participates in the repression of FT expression and floral transition, by interacting closely with the FLC-SVP pathways. Functions in the satellite meristemoid lineage of stomatal development.",NA,NA,Yes,NA,NA
AT5G35750,AHK2,"Histidine kinase 2; Cytokinins (CK) receptor related to bacterial two-component regulators. Functions as a histidine kinase and transmits the stress signal to a downstream MAPK cascade. This protein undergoes an ATP- dependent autophosphorylation at a conserved histidine residue in the kinase core, and a phosphoryl group is then transferred to a conserved aspartate residue in the receiver domain. In the presence of cytokinin, feeds phosphate to phosphorelay-integrating histidine phosphotransfer protein (HPt) and activates subsequent cascade. Involved in meristems establishment in seedl [...] ",Yes,NA,NA,NA,NA
AT1G27320,AHK3,"Histidine kinase 3; Cytokinins (CK) receptor related to bacterial two-component regulators. Functions as a histidine kinase and transmits the stress signal to a downstream MAPK cascade. This protein undergoes an ATP- dependent autophosphorylation at a conserved histidine residue in the kinase core, and a phosphoryl group is then transferred to a conserved aspartate residue in the receiver domain. In the presence of cytokinin, feeds phosphate to phosphorelay-integrating histidine phosphotransfer protein (HPt) and activates subsequent cascade. Involved in meristems establishment in seedl [...] ",Yes,NA,NA,NA,NA
AT2G01830,AHK4,"Histidine kinase 4; Cytokinins (CK) receptor related to bacterial two-component regulators. Binds also the synthetic urea-type cytokinin thiadiazuron, a potent defoliant and herbicide. Functions as a histidine kinase and transmits the stress signal to a downstream MAPK cascade. This protein undergoes an ATP-dependent autophosphorylation at a conserved histidine residue in the kinase core, and a phosphoryl group is then transferred to a conserved aspartate residue in the receiver domain. In the presence of cytokinin, feeds phosphate to phosphorelay-integrating histidine phosphotransfer  [...] ",Yes,NA,NA,NA,NA
AT5G57390,AIL5,AP2-like ethylene-responsive transcription factor AIL5; Probably acts as a transcriptional activator. Binds to the GCC-box pathogenesis-related promoter element. May be involved in the regulation of gene expression by stress factors and by components of stress signal transduction pathways (By similarity). Involved in the regulation of floral organs size; Belongs to the AP2/ERF transcription factor family. AP2 subfamily.,NA,NA,NA,NA,NA
AT2G02470,AL6,"PHD finger protein ALFIN-LIKE 6; Histone-binding component that specifically recognizes H3 tails trimethylated on 'Lys-4' (H3K4me3), which mark transcription start sites of virtually all active genes; Belongs to the Alfin family.",NA,NA,Yes,NA,Yes
AT4G00730,ANL2,Homeobox-leucine zipper protein ANTHOCYANINLESS 2; Probable transcription factor involved in the regulation of the tissue-specific accumulation of anthocyanins and in cellular organization of the primary root.,NA,NA,Yes,NA,Yes
AT1G79430,APL,"Myb family transcription factor APL; Transcription factor required for phloem identity. Has a dual role both in promoting phloem differentiation and in repressing xylem differentiation during vascular development. Regulates the expression of the transcription factor NAC045 (AC A4VCM0). May activate the transcription of specific genes involved in phosphate uptake or assimilation. Promotes flowering through transcriptional activation of both FT and its transport machinery component, FTIP1.",NA,Yes,NA,Yes,NA
AT2G28350,ARF10,Auxin response factor 10; Auxin response factors (ARFs) are transcriptional factors that bind specifically to the DNA sequence 5'-TGTCTC-3' found in the auxin-responsive promoter elements (AuxREs). Could act as transcriptional activator or repressor. Formation of heterodimers with Aux/IAA proteins may alter their ability to modulate early auxin response genes expression.,Yes,NA,NA,NA,NA
AT4G30080,ARF16,Auxin response factor 16; Auxin response factors (ARFs) are transcriptional factors that bind specifically to the DNA sequence 5'-TGTCTC-3' found in the auxin-responsive promoter elements (AuxREs). Could act as transcriptional activator or repressor. Formation of heterodimers with Aux/IAA proteins may alter their ability to modulate early auxin response genes expression.,Yes,NA,NA,NA,NA
AT1G77850,ARF17,Auxin response factor 17; Auxin response factors (ARFs) are transcriptional factors that bind specifically to the DNA sequence 5'-TGTCTC-3' found in the auxin-responsive promoter elements (AuxREs). Could act as transcriptional activator or repressor. Formation of heterodimers with Aux/IAA proteins may alter their ability to modulate early auxin response genes expression.,Yes,NA,NA,NA,NA
AT1G19220,ARF19,Auxin response factor 19; Auxin response factors (ARFs) are transcriptional factors that bind specifically to the DNA sequence 5'-TGTCTC-3' found in the auxin-responsive promoter elements (AuxREs). Could act as transcriptional activator or repressor. Formation of heterodimers with Aux/IAA proteins may alter their ability to modulate early auxin response genes expression. Involved in ethylene responses. Regulates lateral root formation through direct regulation of LBD16 and/or LBD29. Functionally redundant with ARF7.,Yes,NA,NA,NA,NA
AT5G20730,ARF7,"Auxin response factor 7; Auxin response factors (ARFs) are transcriptional factors that bind specifically to the DNA sequence 5'-TGTCTC-3' found in the auxin-responsive promoter elements (AuxREs). Act as a transcriptional activator of several tropic stimulus-induced (TSI) genes, including SAUR50. Formation of heterodimers with Aux/IAA proteins may alter their ability to modulate early auxin response genes expression. Required for differential growth responses of aerial tissues. Involved in ethylene responses. Regulates lateral root formation through direct regulation of LBD16 and/or LB [...] ",Yes,NA,NA,NA,NA
AT3G16857,ARR1,Two-component response regulator ARR1; Transcriptional activator that binds specifically to the DNA sequence 5'-[AG]GATT-3'. Functions as a response regulator involved in His-to-Asp phosphorelay signal transduction system. Phosphorylation of the Asp residue in the receiver domain activates the ability of the protein to promote the transcription of target genes. Could directly activate some type-A response regulators in response to cytokinins. Regulates SHY2 by binding to its promoter. Involved in the root-meristem size determination through the regulation of cell differentiation. Belon [...] ,Yes,NA,NA,NA,NA
AT4G31920,ARR10,Two-component response regulator ARR10; Transcriptional activator that binds specifically to the DNA sequence 5'-[AG]GATT-3'. Functions as a response regulator involved in His-to-Asp phosphorelay signal transduction system. Phosphorylation of the Asp residue in the receiver domain activates the ability of the protein to promote the transcription of target genes. Could directly activate some type-A response regulators in response to cytokinins.,Yes,NA,NA,NA,NA
AT2G25180,ARR12,Two-component response regulator ARR12; Transcriptional activator that binds specifically to the DNA sequence 5'-[AG]GATT-3'. Functions as a response regulator involved in His-to-Asp phosphorelay signal transduction system. Phosphorylation of the Asp residue in the receiver domain activates the ability of the protein to promote the transcription of target genes. Could directly activate some type-A response regulators in response to cytokinins. Involved in the root-meristem size determination through the regulation of cell differentiation. Involved in activating SHY2 during meristem gro [...] ,Yes,NA,NA,NA,NA
AT4G16110,ARR2,Two-component response regulator ARR2; Transcriptional activator that binds specifically to the DNA sequence 5'-[AG]GATT-3'. Functions as a response regulator involved in His-to-Asp phosphorelay signal transduction system. Phosphorylation of the Asp residue in the receiver domain activates the ability of the protein to promote the transcription of target genes. Could directly activate some type-A response regulators in response to cytokinins. Involved in the expression of nuclear genes for components of mitochondrial complex I. Promotes cytokinin-mediated leaf longevity. Involved in th [...] ,Yes,NA,NA,NA,NA
AT1G69780,ATHB-13,Homeobox-leucine zipper protein ATHB-13; Probable transcription factor that may act in the sucrose- signaling pathway.,NA,NA,NA,NA,NA
AT1G52150,ATHB-15,"Homeobox-leucine zipper protein ATHB-15; Probable transcription factor involved in the regulation of meristem development to promote lateral organ formation. May regulates procambial and vascular tissue formation or maintenance, and vascular development in inflorescence stems; Belongs to the HD-ZIP homeobox family. Class III subfamily.",NA,NA,NA,NA,NA
AT1G26960,ATHB-23,Homeobox-leucine zipper protein ATHB-23; Probable transcription factor; Belongs to the HD-ZIP homeobox family. Class I subfamily.,NA,NA,NA,NA,NA
AT4G32880,ATHB-8,Homeobox-leucine zipper protein ATHB-8; Probable transcription factor involved in the regulation of vascular development. May promote differentiation of precambial and cambial cells.,NA,Yes,NA,Yes,NA
AT1G70920,ATHB-X,Homeobox-leucine zipper protein ATHB-X; Probable transcription factor.,NA,NA,NA,NA,NA
AT2G31650,ATX1-2,"Histone H3-lysine(4) N-trimethyltransferase ATX1; [Isoform 1]: Binds to the promoter and regulates the transcription of target genes, maintaining them in an active state; at promoters, required for TATA binding proteins (TBPs, e.g. TBP1 and TBP2) and RNA polymerase II (Pol II) recruitment, and, in a subsequent event, is recruited by a phosphorylated form of Pol II to the +300-bp region of transcribed sequences to trimethylates nucleosomes. Histone trimethyltransferase that trimethylates 'Lys-4' of histone H3 (H3K4me3); H3 'Lys-4' methylation represents a specific tag for epigenetic tra [...] ",NA,NA,NA,NA,NA
AT3G50750,BEH1,BES1/BZR1 homolog protein 1.,Yes,NA,NA,NA,NA
AT4G00480,BHLH12,"Transcription factor MYC1; Trancsription activator, when associated with MYB75/PAP1 or MYB90/PAP2.",NA,NA,Yes,NA,Yes
AT2G31280,BHLH155,Transcription factor bHLH155; Transcription factor that may regulate root development.,NA,NA,NA,NA,NA
AT1G63650,BHLH2,"Transcription factor EGL1; Transcription activator, when associated with MYB75/PAP1, MYB90/PAP2 or TT2. Involved in epidermal cell fate specification. Regulates negatively stomata formation but promotes trichome formation. Together with MYB66/WER, promotes the formation of non-hair cells in root epidermis cells in the N position. Whereas together with CPC, promotes the formation of hair cells in root epidermis cells in the H position by inhibiting non-hair cell formation. Seems also to play a role in the activation of anthocyanin biosynthesis, probably together with MYB75/PAP1. Involve [...] ",NA,NA,Yes,NA,Yes
AT3G25710,BHLH32,Transcription factor AIG1; Transcription factor required for MONOPTEROS-dependent root initiation in embryo. Transcriptionally controlled by MONOPTEROS.,NA,NA,Yes,NA,Yes
AT2G42300,BHLH48,Transcription factor bHLH48.,NA,Yes,NA,Yes,NA
AT1G27740,BHLH54,Transcription factor bHLH54.,NA,NA,Yes,NA,Yes
AT2G24260,BHLH66,Transcription factor bHLH66.,NA,NA,Yes,NA,Yes
AT4G30980,BHLH69,Transcription factor bHLH69.,NA,NA,Yes,NA,Yes
AT5G58010,BHLH82,Transcription factor bHLH82.,NA,NA,Yes,NA,Yes
AT1G66470,BHLH83,Transcription factor bHLH83.,NA,NA,Yes,NA,Yes
AT4G33880,BHLH85,Transcription factor bHLH85.,NA,NA,Yes,NA,Yes
AT5G37800,BHLH86,Putative transcription factor bHLH086.,NA,NA,Yes,NA,Yes
AT3G45260,BIB,"Zinc finger protein BALDIBIS; Transcription factor that, together with JKD, regulates tissue boundaries and asymmetric cell division in roots by a rapid up- regulation of 'SCARECROW' (SCR), thus controlling the nuclear localization of 'SHORT-ROOT' (SHR) and restricting its action. Confines CYCD6 expression to the cortex-endodermis initial/daughter (CEI/CEID) tissues. Binds DNA via its zinc fingers. Recognizes and binds to SCL3 promoter sequence 5'-AGACAA-3' to promotes its expression when in complex with RGA.",NA,NA,NA,NA,NA
AT2G46020,BRM,"ATP-dependent helicase BRM; ATPase subunit of a multiprotein complex equivalent of the SWI/SNF complex that acts by remodeling the chromatin by catalyzing an ATP-dependent alteration in the structure of nucleosomal DNA. Represses embryonic genes in leaves and controls shoot development and flowering. Activates flower homeotic genes. The association of BRM with its target genes requires REF6. Necessary to acquire heat stress (HS) memory, by globally binding to HS memory genes.",NA,NA,NA,NA,NA
AT4G35040,BZIP19,"Basic leucine zipper 19; Transcription factor involved in the response to zinc ion deficiency. Binds to the consensus sequence 5'-[AG]TGTCGACA[CT]-3' also called zinc deficiency response element (ZDRE). The ZDRE sequence is conserved in the plant kingdom and present in the promoters of genes that constitute the primary response to zinc deficiency, comprising additional ZIP metal transporter genes. Required for zinc accumulation in roots. Mediates the expression of the zinc transporters ZIP3, ZIP4, ZIP5 and ZIP9 during growth in zinc-deficient conditions. ZIP9 transporter is involved in [...] ",NA,NA,NA,NA,NA
AT2G16770,BZIP23,"Basic leucine zipper 23; Transcription factor involved in the response to zinc ion deficiency. Binds to the consensus sequence 5'-[AG]TGTCGACA[CT]-3' also called zinc deficiency response element (ZDRE). The ZDRE sequence is conserved in the plant kingdom and present in the promoters of genes that constitute the primary response to zinc deficiency, comprising additional ZIP metal transporter genes. Required for zinc accumulation in roots. Mediates the expression of the zinc transporter ZIP12 during growth in zinc- deficient conditions. ZIP12 transporter is involved in zinc uptake in roots.",NA,NA,NA,NA,NA
AT1G19350,BZR2,"Protein BRASSINAZOLE-RESISTANT 2; Positive regulator of brassinosteroid (BR) signaling. Transcription factor that activates target gene expression by binding specifically to the DNA sequence 5'-CANNTG-3'(E box) through its N- terminal domain. Can bind individually to the promoter as a homodimer or synergistically as a heterodimer with BIM1, BIM2 or BIM3. The C- terminal domain is probably involved in transcriptional activation. Recruits the transcription elongation factor IWS1 to control BR- regulated gene expression. Forms a trimeric complex with IWS1 and ASHH2/SDG8 to regulate BR-reg [...] ",Yes,NA,NA,NA,NA
AT5G14170,CHC1-2,SWI/SNF complex component SNF12 homolog; Involved in transcriptional activation and repression of select genes by chromatin remodeling (alteration of DNA-nucleosome topology); Belongs to the SMARCD family.,NA,NA,NA,NA,NA
AT3G06010,CHR12,"Probable ATP-dependent DNA helicase CHR12; Probable chromatin-remodeling factor that is functionally redundant with CHR23 in root and shoot stem cell initiation, and root apical meristem (RAM) and shoot apical meristem (SAM) maintenance. Plays an important role in mediating the temporary plant growth arrest induced upon perception of stress. May promote seed maturation and repress initiation of germination.",NA,NA,NA,NA,NA
AT5G19310,CHR23,Probable ATP-dependent DNA helicase CHR23; Probable chromatin-remodeling factor that is functionally redundant with CHR12 in root and shoot stem cell initiation and root apical meristem (RAM) and shoot apical meristem (SAM) maintenance. Can associate with the promoter region of WOX5. May promote seed maturation and repress initiation of germination. May repress plant growth.,NA,NA,NA,NA,NA
AT2G46410,CPC,"Transcription factor CPC; Transcription factor. Determines the fate of epidermal cell differentiation. Represses trichome development by lateral inhibition. Together with GL3 or BHLH2, promotes the formation of hair developing cells (H position) in root epidermis, probably by inhibiting non-hair cell formation. Represses the expression of GL2 and WER in H cells. Positively regulates stomatal formation in the hypocotyl.",NA,NA,Yes,NA,Yes
AT4G23750,CRF2,"Ethylene-responsive transcription factor CRF2; Component of the cytokinin signaling pathway involved in cotyledons, leaves, and embryos development. Probably acts as a transcriptional activator. Binds to the GCC-box pathogenesis-related promoter element. May be involved in the regulation of gene expression by stress factors and by components of stress signal transduction pathways (By similarity); Belongs to the AP2/ERF transcription factor family. ERF subfamily.",NA,NA,NA,NA,NA
AT2G39830,DAR2,"Protein DA1-related 2; Acts redundantly with DA1 and DAR1 to regulate endoreduplication during leaf development. Together with DA1 and DAR1, modulates the protein stability of the transcription factors TCP14 and TCP15, which repress endoreduplication by directly regulating the expression of cell-cycle genes. Involved in root phloem development. Is an essential component of early phloem development, long-distance delivery of phloem content, and proper maintenance of root system architecture. Involved in the control of root meristem size. Functions genetically downstream of cytokinin and [...] ",NA,Yes,NA,NA,NA
AT1G07640,DOF1.1,"Dof zinc finger protein DOF1.1; Transcription factor that binds specifically to a 5'-AA[AG]G- 3' consensus core sequence. Enhances the DNA binding of OBF transcription factors to OCS elements (By similarity). Involved in the regulation of root development. The PEAR proteins (e.g. DOF2.4, DOF5.1, DOF3.2, DOF1.1, DOF5.6 and DOF5.3) activate gene expression that promotes radial growth of protophloem sieve elements. Element of a regulatory network controlling indole glucosinolates (IGS) biosynthesis, probably by inducing the expression of accurate genes (e.g. CYP83B1). Promotes apical dominance.",NA,NA,NA,NA,NA
AT2G28810,DOF2.2,Dof zinc finger protein DOF2.2; Transcription factor that binds specifically to a 5'-AA[AG]G- 3' consensus core sequence.,NA,NA,NA,NA,NA
AT2G37590,DOF2.4,"Dof zinc finger protein DOF2.4; Transcription factor that binds specifically to a 5'-AA[AG]G- 3' consensus core sequence (By similarity). Probably involved in early processes for vascular development. The PEAR proteins (e.g. DOF2.4, DOF5.1, DOF3.2, DOF1.1, DOF5.6 and DOF5.3) activate gene expression that promotes radial growth of protophloem sieve elements. Triggers the transcription of HD-ZIP III genes, especially in the central domain of vascular tissue.",NA,NA,NA,NA,NA
AT3G45610,DOF3.2,"Dof zinc finger protein DOF3.2; Transcription factor that negatively affects seed germination and opposes TCP14 function in the regulation of a specific set of abscisic acid-related genes. The PEAR proteins (e.g. DOF2.4, DOF5.1, DOF3.2, DOF1.1, DOF5.6 and DOF5.3) activate gene expression that promotes radial growth of protophloem sieve elements.",NA,NA,NA,NA,NA
AT3G55370,DOF3.6,Dof zinc finger protein DOF3.6; Transcription factor that binds specifically to a 5'-AA[AG]G- 3' consensus core sequence. Enhances the DNA binding of OBF transcription factors to OCS elements.,NA,NA,NA,NA,NA
AT5G02460,DOF5.1,"Dof zinc finger protein DOF5.1; Transcription factor that binds specifically to a 5'-AA[AG]G- 3' consensus core sequence (By similarity). Binds to 5'-TAAAGT-3' motif in REV promoter to triggers its transcription, thus regulating adaxial- abaxial polarity and influencing leaf axial patterning in an auxin transport- and response-dependent manner (e.g. IAA6 and IAA19 genes expression). Probably involved in early processes for vascular development. The PEAR proteins (e.g. DOF2.4, DOF5.1, DOF3.2, DOF1.1, DOF5.6 and DOF5.3) activate gene expression that promotes radial growth of protophloem  [...] ",NA,NA,NA,NA,NA
AT5G60200,DOF5.3,"Dof zinc finger protein DOF5.3; Transcription factor that binds specifically to a 5'-AA[AG]G- 3' consensus core sequence (By similarity). The PEAR proteins (e.g. DOF2.4, DOF5.1, DOF3.2, DOF1.1, DOF5.6 and DOF5.3) activate gene expression that promotes radial growth of protophloem sieve elements.",NA,Yes,NA,NA,NA
AT5G62940,DOF5.6,"Dof zinc finger protein DOF5.6; Transcription factor that binds specifically to a 5'-AA[AG]G- 3' consensus core sequence (By similarity). Promotes expression. The PEAR proteins (e.g. DOF2.4, DOF5.1, DOF3.2, DOF1.1, DOF5.6 and DOF5.3) activate gene expression that promotes radial growth of protophloem sieve elements. Involved in the regulation of interfascicular cambium formation and vascular tissue development, particularly at a very early stage during inflorescence stem development; promotes both cambium activity and phloem specification, but prevents xylem specification.",NA,Yes,NA,NA,NA
AT5G16780,DOT2,"SART-1 family protein DOT2; Plays a role in root, shoot and flower development. Probably required for normal root and shoot meristem organization and maintenance and the proper expression of PIN and PLT genes. Involved in leaf vasculature patterning ; Belongs to the SNU66/SART1 family.",NA,Yes,NA,NA,NA
AT5G03415,DPB,Transcription factor-like protein DPB; Involved in the regulation of the G1/S transition. Increases the DNA binding activity of E2F proteins after heterodimerization. The complex DPB/E2FC restricts cell division and lateral root initiation and may function as a negative regulator of E2F-regulated genes. The interaction with SKP2A is controlled by auxin.,NA,NA,NA,NA,NA
AT5G22220,E2FB,"Transcription factor E2FB; Transcription activator that binds DNA cooperatively with DP proteins through the E2 recognition site, 5'-TTTC[CG]CGC-3' found in the promoter region of a number of genes whose products are involved in cell cycle regulation or in DNA replication. The binding of retinoblastoma-related proteins represses transactivation. Involved in the control of cell-cycle progression from G1 to S phase and from G2 to M phase. Stimulates cell proliferation and delays differentiation. Represses cell enlargement and endoreduplication in auxin-free conditions.",NA,NA,Yes,NA,Yes
AT2G03500,EFM,"Myb family transcription factor EFM; Transcription factor acting as a flowering repressor, directly repressing FT expression in a dosage-dependent manner in the leaf vasculature.",NA,NA,NA,NA,NA
AT1G36060,ERF055,Ethylene-responsive transcription factor ERF055; Probably acts as a transcriptional activator. Binds to the GCC-box pathogenesis-related promoter element. May be involved in the regulation of gene expression by stress factors and by components of stress signal transduction pathways (By similarity); Belongs to the AP2/ERF transcription factor family. ERF subfamily.,NA,NA,NA,NA,NA
AT5G61600,ERF104,Ethylene-responsive transcription factor ERF104; Probably acts as a transcriptional activator. Binds to the GCC-box pathogenesis-related promoter element. May be involved in the regulation of gene expression by stress factors and by components of stress signal transduction pathways (By similarity).,NA,Yes,NA,NA,NA
AT5G56780,ET2,"Protein EFFECTOR OF TRANSCRIPTION 2; Transcriptional regulator involved in the regulation of cell differentiation in meristems. Probably regulates the expression of various KNAT genes involved in the maintenance of the cells in an undifferentiated, merismastic state. Plays a role in the regulation of gibberellin 20 oxidase and the gibberellin-regulated protein GASA4. Localizes in the nucleus during the cellular differentiation state and may act via a single strand cutting domain. Transcriptional regulator required for the induction of dormancy during late seed development. Interacts ge [...] ",NA,Yes,NA,Yes,NA
AT1G01380,ETC1,"MYB-like transcription factor ETC1; MYB-type transcription factor involved in epidermal cell fate specification. Acts as a negative regulator of trichome development, by mediating lateral inhibition. Promotes the formation of hair developing cells in H position in root epidermis, probably by inhibiting non-hair cell formation.",NA,NA,Yes,NA,Yes
AT1G66340,ETR1,"Ethylene receptor 1; Ethylene receptor related to bacterial two-component regulators. Acts as a redundant negative regulator of ethylene signaling. In the presence of ethylene, the auto-kinase activity of ETR1 is inhibited and the non- phosphorylated kinase domain binds tightly to the corresponding domain of EIN2.",Yes,NA,NA,NA,NA
AT2G36720,F13K3.12,Acyl-CoA N-acyltransferase with RING/FYVE/PHD-type zinc finger domain-containing protein.,NA,NA,NA,NA,NA
AT1G62310,F24O1.3,Transcription factor jumonji (JmjC) domain-containing protein.,NA,NA,NA,NA,NA
AT2G23780,F27L4.4,Putative RING zinc finger protein.,NA,NA,NA,NA,NA
AT5G11340,F2I11.230,Acyl-CoA N-acyltransferases (NAT) superfamily protein.,NA,NA,NA,NA,NA
AT1G26870,FEZ,Protein FEZ; Promotes periclinal root capforming cell divisions. Activates expression of its negative regulator SMB in a feedback loop for controlled switches in cell division plane.,NA,NA,NA,NA,NA
