AT5G53200,TRY,"Transcription factor TRY; Transcription factor. Involved in epidermal cell fate specification. Negative regulator of trichome development, including endoreplication, by lateral inhibition involving intercellular interactions. Promotes the formation of hair developing cells (trichoblasts) in H position in root epidermis, probably by inhibiting non-hair cell (atrichoblasts) formation.",NA,NA,Yes,NA,Yes
AT3G22780,TSO1,"CRC domain-containing protein TSO1; Probable floral-specific cell division component, required for proper organ formation in flowers. Regulates the floral meristem cell division and the inflorescence meristem organization. Plays a role in development of both male and female reproductive tissues. Belongs to the lin-54 family.",NA,NA,Yes,NA,NA
AT5G24520,TTG1,"Protein TRANSPARENT TESTA GLABRA 1; May regulate MYC transcription factors. Involved in epidermal cell fate specification such as trichome and root hair development, seed mucilage production, and anthocyanin biosynthesis by acting at the dihydroflavonol-4-reductase (DFR) step. Together with GL1 and GL3, promotes trichome formation. Activates the transcription of GL2.",NA,NA,Yes,NA,Yes
AT2G47270,UPB1,"Transcription factor UPBEAT1; Transcription factor that modulates the balance between cellular proliferation and differentiation in root growth. Does not act through cytokinin and auxin signaling, but by repressing peroxidase expression in the elongation zone.",NA,NA,NA,NA,NA
AT5G14750,WER,"Transcription factor WER; Transcription activator, when associated with BHLH2/EGL3/MYC146 or BHLH12/MYC1. Involved in epidermal cell fate specification in roots and hypocotyl. Together with GL3 or BHLH2, promotes the formation of non-hair developing cells (atrichoblasts) et the N position in root epidermis. Regulates stomata spatial distribution in hypocotyls. Binds to the WER-binding sites (WBS) promoter regions and activates the transcription of target genes such as GL2 and of CPC.",NA,NA,Yes,NA,Yes
AT3G57670,WIP2-2,"Zinc finger protein WIP2; Transcriptional regulator required for normal differentiation of the ovary transmitting tract cells and pollen tube growth. In Arabidopsis, the transmitting tract facilitates the transport of pollen tubes to the ovules for fertilization. May play a role in the regulation of AGL8/FUL, which is required for normal pattern of cell division, expansion and differentiation during morphogenesis of the silique. Plays a role in replum development by the activation of the homeobox protein KNAT1 ; Belongs to the WIP C2H2-type zinc-finger protein family.",NA,NA,NA,NA,NA
AT3G55770,WLIM2B,LIM domain-containing protein WLIM2b; Binds to actin filaments and promotes cross-linking into thick bundles. Has an actin-stabilizing activity. The actin regulatory activities are not regulated by pH and [Ca(2+)].,NA,NA,NA,NA,NA
AT1G20700,WOX14,WUSCHEL-related homeobox 14; Transcription factor which may be involved in developmental processes.,NA,Yes,NA,NA,NA
AT4G39410,WRKY13,"Probable WRKY transcription factor 13; Transcription factor. Interacts specifically with the W box (5'-(T)TGAC[CT]-3'), a frequently occurring elicitor-responsive cis- acting element (By similarity); Belongs to the WRKY group II-c family.",NA,NA,NA,NA,NA
AT2G37260,WRKY44,"WRKY transcription factor 44; Transcription factor. Interacts specifically with the W box (5'-(T)TGAC[CT]-3'), a frequently occurring elicitor-responsive cis- acting element. Regulates trichome development, production of mucilage and tannin in seed coats, and maybe root hair development.",NA,NA,Yes,NA,NA
AT5G13080,WRKY75,"Probable WRKY transcription factor 75; Transcription factor. Interacts specifically with the W box (5'-(T)TGAC[CT]-3'), a frequently occurring elicitor-responsive cis- acting element (By similarity); Belongs to the WRKY group II-c family.",NA,NA,Yes,NA,NA
AT1G10480,ZFP5,"Zinc finger protein 5; Probable transcription factor required for the initiation of inflorescence trichomes in response to gibberellin (GA). Acts upstream of GIS, GIS2, ZFP8 and the trichome initiation regulators GL1 and GL3. Binds the promoter region of ZFP8, which may be a direct target of ZPF5. Is not involved in the regulation of trichome branching. Modulates root hair initiation and elongation in response to cytokinin and ethylene signals by directly promoting expression of the CAPRICE (CPC) gene.",NA,NA,Yes,NA,Yes
AT1G67030,ZFP6,"Zinc finger protein 6; Probable transcription factor required for the initiation of inflorescence trichomes in response to gibberellin and cytokinin. Acts upstream of GIS, GIS2, ZFP8, ZFP5 and the trichome initiation regulators GL1 and GL3. Acts as negative regulator of abscisic acid (ABA) signaling during germination and early seedling development.",NA,NA,Yes,NA,Yes
AT2G41940,ZFP8,Zinc finger protein 8; Probable transcription factor required for the initiation of inflorescence trichomes in response to gibberellin and cytokinin. Is not involved in the regulation of trichome branching. Is functionally equivalent to GIS2. Acts as negative regulator of abscisic acid (ABA) signaling during germination and early seedling development.,NA,NA,Yes,NA,Yes